{
  "bytes_written": 599,
  "conversion_fidelity": {
    "level": "approximating",
    "omesse": {
      "categorie_omesse": 0,
      "esempi_omessi": 0,
      "omesse_per_byte": 0,
      "ragioni_omesse": 0
    },
    "omesse_esatte": true,
    "reasons": [
      {
        "code": "format_constraint",
        "detail": "csv: fedeltà condizionata ai tipi e alle semantiche del contratto"
      },
      {
        "code": "format_constraint",
        "detail": "geojson: fedeltà condizionata ai tipi e alle semantiche del contratto"
      },
      {
        "code": "nullability_changed",
        "detail": "la nullability dell'attributo la definisce il formato",
        "field_index": 0,
        "layer_index": 0
      },
      {
        "code": "nullability_changed",
        "detail": "la nullability dell'attributo la definisce il formato",
        "field_index": 1,
        "layer_index": 0
      },
      {
        "code": "nullability_changed",
        "detail": "la nullability dell'attributo la definisce il formato",
        "field_index": 2,
        "layer_index": 0
      },
      {
        "code": "nullability_changed",
        "detail": "la nullability dell'attributo la definisce il formato",
        "field_index": 3,
        "layer_index": 0
      },
      {
        "code": "nullability_changed",
        "detail": "la nullability dell'attributo la definisce il formato",
        "field_index": 4,
        "layer_index": 0
      },
      {
        "code": "nullability_changed",
        "detail": "la nullability dell'attributo la definisce il formato",
        "field_index": 5,
        "layer_index": 0
      },
      {
        "code": "nullability_changed",
        "detail": "la nullability dell'attributo la definisce il formato",
        "field_index": 6,
        "layer_index": 0
      },
      {
        "code": "nullability_changed",
        "detail": "la nullability dell'attributo la definisce il formato",
        "field_index": 7,
        "layer_index": 0
      },
      {
        "code": "nullability_changed",
        "detail": "la nullability dell'attributo la definisce il formato",
        "field_index": 8,
        "layer_index": 0
      },
      {
        "code": "native_metadata_loss",
        "detail": "crs_id_not_preserved_absent: 1 occorrenze"
      }
    ],
    "troncato": false
  },
  "from": "geojson",
  "layers": [
    {
      "batches": 1,
      "name": "canonico",
      "rows": 5
    }
  ],
  "publish_outcome": "published",
  "read_fidelity": {
    "level": "conditional",
    "omesse": {
      "categorie_omesse": 0,
      "esempi_omessi": 0,
      "omesse_per_byte": 0,
      "ragioni_omesse": 0
    },
    "omesse_esatte": true,
    "reasons": [
      {
        "code": "format_constraint",
        "detail": "geojson: fedeltà condizionata ai tipi e alle semantiche del contratto"
      }
    ],
    "troncato": false
  },
  "read_loss": {
    "counts": [],
    "esempi": [],
    "lossless": false,
    "omesse": {
      "categorie_omesse": 0,
      "esempi_omessi": 0,
      "omesse_per_byte": 0,
      "ragioni_omesse": 0
    },
    "omesse_esatte": true,
    "troncato": false
  },
  "to": "csv",
  "total_rows": 5,
  "write_fidelity": {
    "level": "approximating",
    "omesse": {
      "categorie_omesse": 0,
      "esempi_omessi": 0,
      "omesse_per_byte": 0,
      "ragioni_omesse": 0
    },
    "omesse_esatte": true,
    "reasons": [
      {
        "code": "format_constraint",
        "detail": "csv: fedeltà condizionata ai tipi e alle semantiche del contratto"
      },
      {
        "code": "nullability_changed",
        "detail": "la nullability dell'attributo la definisce il formato",
        "field_index": 0,
        "layer_index": 0
      },
      {
        "code": "nullability_changed",
        "detail": "la nullability dell'attributo la definisce il formato",
        "field_index": 1,
        "layer_index": 0
      },
      {
        "code": "nullability_changed",
        "detail": "la nullability dell'attributo la definisce il formato",
        "field_index": 2,
        "layer_index": 0
      },
      {
        "code": "nullability_changed",
        "detail": "la nullability dell'attributo la definisce il formato",
        "field_index": 3,
        "layer_index": 0
      },
      {
        "code": "nullability_changed",
        "detail": "la nullability dell'attributo la definisce il formato",
        "field_index": 4,
        "layer_index": 0
      },
      {
        "code": "nullability_changed",
        "detail": "la nullability dell'attributo la definisce il formato",
        "field_index": 5,
        "layer_index": 0
      },
      {
        "code": "nullability_changed",
        "detail": "la nullability dell'attributo la definisce il formato",
        "field_index": 6,
        "layer_index": 0
      },
      {
        "code": "nullability_changed",
        "detail": "la nullability dell'attributo la definisce il formato",
        "field_index": 7,
        "layer_index": 0
      },
      {
        "code": "nullability_changed",
        "detail": "la nullability dell'attributo la definisce il formato",
        "field_index": 8,
        "layer_index": 0
      },
      {
        "code": "native_metadata_loss",
        "detail": "crs_id_not_preserved_absent: 1 occorrenze"
      }
    ],
    "troncato": false
  },
  "write_loss": {
    "counts": [
      {
        "categoria": "crs_id_not_preserved_absent",
        "conteggio": 1
      }
    ],
    "esempi": [
      {
        "category": "crs_id_not_preserved_absent",
        "context": "representation=crs_id value_bytes=9",
        "field_index": 0,
        "layer_index": 0
      }
    ],
    "lossless": false,
    "omesse": {
      "categorie_omesse": 0,
      "esempi_omessi": 0,
      "omesse_per_byte": 0,
      "ragioni_omesse": 0
    },
    "omesse_esatte": true,
    "troncato": false
  }
}
